{
  "$schema": "https://json-schema.org/draft/2020-12/schema",
  "$id": "https://patchmesh.dev/schemas/phase0/v1/benchmark-workloads.schema.json",
  "$defs": {
    "interception": { "type": "object", "properties": { "workloadId": { "type": "string", "pattern": "^benchmark_interception_[a-z0-9_]+$" }, "kind": { "const": "interception_latency" }, "operation": { "enum": ["noop_route", "small_file_read", "opaque_shell"] }, "baseline": { "const": "direct_operation" }, "instrumented": { "const": "gateway_observation" }, "warmupSamples": { "type": "integer", "minimum": 1 }, "measuredSamples": { "type": "integer", "minimum": 1 }, "metrics": { "type": "array", "items": { "enum": ["baseline_ns", "instrumented_ns", "overhead_ns", "p50_ns", "p95_ns", "failures"] }, "minItems": 6, "uniqueItems": true } }, "required": ["workloadId", "kind", "operation", "baseline", "instrumented", "warmupSamples", "measuredSamples", "metrics"], "additionalProperties": false },
    "replay": { "type": "object", "properties": { "workloadId": { "type": "string", "pattern": "^benchmark_replay_[0-9]+$" }, "kind": { "const": "replay" }, "eventCount": { "enum": [1000, 10000, 100000] }, "variants": { "type": "array", "items": { "enum": ["canonical", "duplicates", "out_of_order"] }, "minItems": 3, "uniqueItems": true }, "warmupRuns": { "type": "integer", "minimum": 1 }, "measuredRuns": { "type": "integer", "minimum": 1 }, "metrics": { "type": "array", "items": { "enum": ["elapsed_ns", "events_per_second", "peak_memory_bytes", "p50_ns", "p95_ns", "snapshot_digest", "failures"] }, "minItems": 7, "uniqueItems": true } }, "required": ["workloadId", "kind", "eventCount", "variants", "warmupRuns", "measuredRuns", "metrics"], "additionalProperties": false },
    "detectorQuality": { "type": "object", "properties": { "workloadId": { "type": "string", "pattern": "^benchmark_detector_[a-z0-9_]+$" }, "kind": { "const": "detector_quality" }, "detector": { "enum": ["same_symbol_overlap", "stale_read_before_write", "exported_contract_invalidation"] }, "corpusSource": { "const": "phase2_labeled_scenario_corpus" }, "requiredLabels": { "type": "array", "items": { "enum": ["relevant", "irrelevant"] }, "minItems": 2, "uniqueItems": true }, "findingMatchFields": { "type": "array", "items": { "enum": ["detector", "subject_resource", "affected_task", "evidence_path"] }, "minItems": 4, "uniqueItems": true }, "metrics": { "type": "array", "items": { "enum": ["true_positive", "false_positive", "true_negative", "false_negative", "precision", "recall"] }, "minItems": 6, "uniqueItems": true } }, "required": ["workloadId", "kind", "detector", "corpusSource", "requiredLabels", "findingMatchFields", "metrics"], "additionalProperties": false }
  },
  "type": "object", "properties": { "schemaVersion": { "const": 1 }, "definitionVersion": { "const": "phase0-v1" }, "environmentFields": { "type": "array", "items": { "enum": ["timestamp", "commit", "os", "architecture", "cpu", "memoryBytes", "nodeVersion"] }, "minItems": 7, "uniqueItems": true }, "workloads": { "type": "array", "items": { "oneOf": [{ "$ref": "#/$defs/interception" }, { "$ref": "#/$defs/replay" }, { "$ref": "#/$defs/detectorQuality" }] }, "minItems": 9, "uniqueItems": true } }, "required": ["schemaVersion", "definitionVersion", "environmentFields", "workloads"], "additionalProperties": false
}
